id,external_id,field,title,description,tags,requirements,created_at,updated_at,deleted_at
dc3b6566-9266-4628-a662-2051a38ea710,6737229d946638310000a42c,"Cultural, Entertainment and Leisure Activities",Museum Curator,"Manage and oversee collections, exhibitions, and educational programs at a museum or cultural institution.","[""Curation"", ""Museums"", ""Arts"", ""Education""]","[""Master’s degree in Art History, Museum Studies, or related field."", ""Experience in curating exhibits or managing museum collections."", ""Strong knowledge of art history and cultural heritage."", ""Ability to work with museum staff and engage visitors.""]",2024-11-22 22:04:04,2024-11-22 22:04:04,
5fd5bec4-45ad-499b-b716-50a417075159,6737229d946638310000a42d,"Cultural, Entertainment and Leisure Activities",Fitness Trainer,Design and deliver fitness programs tailored to individuals or groups to help them achieve their health and wellness goals.,"[""Fitness"", ""Health"", ""Personal Training"", ""Exercise""]","[""Certification in Personal Training or Fitness Instruction."", ""Experience in conducting fitness assessments and designing programs."", ""Knowledge of exercise techniques, nutrition, and wellness."", ""Excellent communication and motivation skills.""]",2024-11-22 22:04:04,2024-11-22 22:04:04,
b4a8b138-9c51-49a4-8156-b26b1c7b3657,6737229d946638310000a42e,"Cultural, Entertainment and Leisure Activities",Tour Guide,"Lead groups of tourists on excursions, providing information on landmarks, history, and culture.","[""Tourism"", ""Guiding"", ""Culture"", ""History""]","[""High school diploma or equivalent; relevant certifications are a plus."", ""Experience in guiding tours or working in the tourism industry."", ""Strong knowledge of local history and landmarks."", ""Excellent public speaking and interpersonal skills.""]",2024-11-22 22:04:04,2024-11-22 22:04:04,
bc43b595-0cb1-438d-96a6-014c8a0c9126,6737229d946638310000a42f,"Cultural, Entertainment and Leisure Activities",Animator,"Create and perform entertainment activities for guests in resorts, hotels, or cruise ships, ensuring an enjoyable experience.","[""Entertainment"", ""Performing Arts"", ""Animation"", ""Leisure""]","[""Experience in performance arts, animation, or event planning."", ""Ability to engage and entertain diverse groups of people."", ""Excellent communication and improvisational skills."", ""Flexible schedule and ability to work evenings and weekends.""]",2024-11-22 22:04:04,2024-11-22 22:04:04,
b2d38928-c1d6-4f76-b2eb-8aed8953b713,6737229d946638310000a430,Other,Content Writer,"Create engaging written content for websites, blogs, social media, and marketing materials.","[""Writing"", ""Content Creation"", ""Marketing"", ""SEO""]","[""Bachelor’s degree in English, Journalism, Marketing, or related field."", ""Experience in writing for web and digital platforms."", ""Strong knowledge of SEO principles and content strategies."", ""Excellent writing, editing, and proofreading skills.""]",2024-11-22 22:04:04,2024-11-22 22:04:04,
4a91ed8c-ecdb-43c7-99b3-6861af78ddd2,6737229d946638310000a431,Other,Graphic Designer,"Design visual content for marketing campaigns, websites, and branding projects.","[""Design"", ""Graphics"", ""Branding"", ""Creative""]","[""Bachelor’s degree in Graphic Design, Visual Arts, or related field."", ""Proficiency in design software such as Adobe Creative Suite (Photoshop, Illustrator, InDesign)."", ""Strong creativity and attention to detail."", ""Excellent communication skills and the ability to work in a team.""]",2024-11-22 22:04:04,2024-11-22 22:04:04,
693b5455-e22d-4943-987e-bdf5af62ab6e,6737229d946638310000a432,Other,Business Analyst,Analyze business needs and recommend solutions to improve processes and efficiency.,"[""Analysis"", ""Business Solutions"", ""Strategy"", ""Consulting""]","[""Bachelor’s degree in Business Administration, Economics, or related field."", ""Experience in business analysis or consulting."", ""Strong problem-solving and strategic thinking abilities."", ""Proficiency in data analysis tools such as Excel or Tableau.""]",2024-11-22 22:04:04,2024-11-22 22:04:04,
0aef807f-6c37-41d4-b4fb-b60edce64c8b,6737229d946638310000a433,Other,IT Support Specialist,Provide technical support and troubleshooting assistance to employees and clients regarding software and hardware issues.,"[""IT Support"", ""Technology"", ""Troubleshooting"", ""Customer Service""]","[""Bachelor’s degree in Computer Science, Information Technology, or related field."", ""Experience in IT support or technical troubleshooting."", ""Strong knowledge of computer systems and networking."", ""Excellent communication and customer service skills.""]",2024-11-22 22:04:04,2024-11-22 22:04:04,
48453452-7532-4a08-a197-fd77777050b6,6737229d946638310000a434,Other,Operations Manager,"Manage day-to-day operations of a company or department, ensuring processes are efficient and goals are met.","[""Operations"", ""Management"", ""Efficiency"", ""Leadership""]","[""Bachelor’s degree in Business Administration or related field."", ""Proven experience in operations management."", ""Strong leadership and organizational skills."", ""Ability to solve problems quickly and make decisions under pressure.""]",2024-11-22 22:04:04,2024-11-22 22:04:04,
16de0997-3747-4277-ac9f-4643a2de3815,6737229d946638310000a435,Other,Customer Success Manager,Ensure customers are satisfied with products or services and help them achieve their goals through product use.,"[""Customer Success"", ""Support"", ""Relationship Management"", ""Customer Retention""]","[""Bachelor’s degree in Business, Marketing, or related field."", ""Experience in customer success or account management."", ""Strong problem-solving and communication skills."", ""Ability to build relationships with customers and internal teams.""]",2024-11-22 22:04:04,2024-11-22 22:04:04,
bf899006-7352-4a43-a353-d37e02db3bb0,6737229d946638310000a436,Other,Supply Chain Coordinator,"Manage the flow of goods and services, ensuring that the supply chain is efficient and cost-effective.","[""Supply Chain"", ""Logistics"", ""Operations"", ""Inventory Management""]","[""Bachelor’s degree in Supply Chain Management, Logistics, or related field."", ""Experience in supply chain coordination or logistics."", ""Strong organizational and analytical skills."", ""Proficiency in supply chain software and tools.""]",2024-11-22 22:04:04,2024-11-22 22:04:04,
d6681100-b631-457c-8401-0763ed76fa80,6737229d946638310000a437,Other,Quality Assurance Specialist,Monitor and ensure the quality of products and services meets company and industry standards.,"[""Quality Assurance"", ""Testing"", ""Standards"", ""Compliance""]","[""Bachelor’s degree in Quality Assurance, Engineering, or related field."", ""Experience in quality control or testing environments."", ""Strong attention to detail and problem-solving skills."", ""Knowledge of industry standards and regulatory requirements.""]",2024-11-22 22:04:04,2024-11-22 22:04:04,
9e648c00-39fe-4b9a-abb7-ea2b8a0de478,6737229d946638310000a438,Other,Digital Marketing Specialist,Develop and execute digital marketing campaigns to increase brand awareness and drive traffic and sales.,"[""Digital Marketing"", ""SEO"", ""Social Media"", ""Content Marketing""]","[""Bachelor’s degree in Marketing, Business, or related field."", ""Experience in digital marketing or social media marketing."", ""Strong understanding of SEO and paid advertising strategies."", ""Proficiency with digital marketing tools and analytics platforms.""]",2024-11-22 22:04:04,2024-11-22 22:04:04,
c8ae8f0b-0ad2-4286-a5d5-f36070fab6d7,6737229d946638310000a439,Other,Legal Assistant,"Support legal teams by managing case files, conducting research, and preparing legal documents.","[""Legal"", ""Assistance"", ""Research"", ""Documentation""]","[""Associate’s degree in Paralegal Studies or related field."", ""Experience in a legal or law firm environment."", ""Strong organizational and research skills."", ""Proficiency with legal documentation and case management systems.""]",2024-11-22 22:04:04,2024-11-22 22:04:04,
e8fcbcd1-0b7e-4943-865d-b2f8f35613ec,6737229d946638310000a43a,Public administration and defense; compulsory social security,Policy Advisor,"Provide strategic advice to government bodies on public policy issues, ensuring alignment with current legislation and public interests.","[""Policy"", ""Government"", ""Advisory"", ""Public Administration""]","[""Bachelor’s degree in Political Science, Public Policy, or related field."", ""Experience in policy analysis or government advisory roles."", ""Strong understanding of public administration and legislative processes."", ""Excellent communication, research, and analytical skills.""]",2024-11-22 22:04:04,2024-11-22 22:04:04,
8f3344c0-ae30-43f0-b04f-2f1561803256,6737229d946638310000a43b,Public administration and defense; compulsory social security,Public Health Administrator,"Manage public health programs and services, ensuring effective delivery of health care services to the community.","[""Public Health"", ""Administration"", ""Healthcare"", ""Government""]","[""Bachelor’s or Master’s degree in Public Health, Healthcare Administration, or related field."", ""Experience in managing healthcare services or public health programs."", ""Strong leadership, organizational, and budget management skills."", ""Knowledge of healthcare policies and regulatory requirements.""]",2024-11-22 22:04:04,2024-11-22 22:04:04,
aa2f3e0a-3d62-46c8-815d-824e7791d8eb,6737229d946638310000a43c,Public administration and defense; compulsory social security,Social Security Officer,"Assist citizens in understanding and accessing their social security benefits, ensuring compliance with policies and regulations.","[""Social Security"", ""Public Services"", ""Government"", ""Support""]","[""Bachelor’s degree in Social Sciences, Public Administration, or related field."", ""Experience in social services or public sector roles."", ""Strong interpersonal and communication skills."", ""Knowledge of social security systems and regulations.""]",2024-11-22 22:04:04,2024-11-22 22:04:04,
56e75753-dee6-4c2f-bf93-a2cc9c421661,6737229d946638310000a43d,Public administration and defense; compulsory social security,Government Compliance Officer,"Ensure government departments adhere to all regulatory and compliance requirements, conducting audits and assessments as needed.","[""Compliance"", ""Government"", ""Audit"", ""Regulations""]","[""Bachelor’s degree in Law, Public Administration, or related field."", ""Experience in compliance monitoring or regulatory roles."", ""Strong knowledge of governmental policies and legal frameworks."", ""Excellent attention to detail and communication skills.""]",2024-11-22 22:04:04,2024-11-22 22:04:04,
ed3e5449-9e6d-4608-9e2b-dffedcbab174,6737229d946638310000a43e,Public administration and defense; compulsory social security,Defense Analyst,"Provide strategic analysis and recommendations related to defense policies and programs, supporting national security objectives.","[""Defense"", ""Analysis"", ""Security"", ""Government""]","[""Bachelor’s degree in Political Science, International Relations, or related field."", ""Experience in defense policy analysis or security studies."", ""Strong analytical and research skills."", ""Knowledge of military systems and defense strategies.""]",2024-11-22 22:04:04,2024-11-22 22:04:04,
7878bfb5-a212-4d2a-a822-4d30c11c6574,6737229d946638310000a43f,Mining and quarrying,Mining Engineer,"Design and manage mining operations, ensuring efficient extraction of minerals and overseeing the safety of operations.","[""Mining"", ""Engineering"", ""Safety"", ""Operations""]","[""Bachelor’s degree in Mining Engineering or related field."", ""Experience in mining operations and management."", ""Strong knowledge of mining techniques, safety regulations, and environmental concerns."", ""Ability to work in challenging environments and oversee large teams.""]",2024-11-22 22:04:04,2024-11-22 22:04:04,
db1a191b-bb42-4669-b755-072d3b14fcfe,6737229d946638310000a440,Mining and quarrying,Geologist,Conduct geological surveys and research to evaluate mineral deposits and support mining operations.,"[""Geology"", ""Mining"", ""Research"", ""Environmental Science""]","[""Bachelor’s degree in Geology or related field."", ""Experience in geological surveying and mineral exploration."", ""Strong analytical and research skills."", ""Knowledge of environmental impact assessments and mining regulations.""]",2024-11-22 22:04:04,2024-11-22 22:04:04,
e5c93fc0-b37d-4d72-a331-ff087b054746,6737229d946638310000a441,Mining and quarrying,Safety Officer (Mining),"Oversee safety protocols and risk management in mining operations, ensuring the well-being of workers and compliance with safety standards.","[""Safety"", ""Mining"", ""Regulations"", ""Compliance""]","[""Bachelor’s degree in Occupational Health and Safety or related field."", ""Experience in mining safety or industrial safety roles."", ""Knowledge of mining safety regulations and risk assessment techniques."", ""Strong communication and training skills.""]",2024-11-22 22:04:04,2024-11-22 22:04:04,
6f9d7cd3-14ab-41d2-8630-42142951dbe9,6737229d946638310000a442,Mining and quarrying,Mining Technician,Support mining engineers and geologists by performing technical tasks related to the operation and maintenance of mining equipment.,"[""Mining"", ""Technology"", ""Maintenance"", ""Operations""]","[""Associate’s degree in Mining Technology or related field."", ""Experience with mining equipment and technology."", ""Strong technical and mechanical skills."", ""Ability to work in a physically demanding environment.""]",2024-11-22 22:04:04,2024-11-22 22:04:04,
7e0a8ae8-d430-418e-9b89-0ea8be78ef48,6737229d946638310000a443,Mining and quarrying,Blasting Supervisor,"Supervise and oversee blasting operations in mining and quarrying projects, ensuring compliance with safety and environmental standards.","[""Blasting"", ""Mining"", ""Operations"", ""Safety""]","[""Bachelor’s degree in Mining Engineering, Geology, or related field."", ""Experience in managing blasting operations in mining environments."", ""Knowledge of explosives handling, safety protocols, and regulatory requirements."", ""Strong leadership and problem-solving skills.""]",2024-11-22 22:04:04,2024-11-22 22:04:04,
