id,external_id,field,title,description,tags,requirements,created_at,updated_at,deleted_at
4faf3782-1f76-44b4-9087-74af06c42237,6737229d946638310000a3d5,Wholesale and retail trade; repair and maintenance of motor vehicles,Automotive Sales Associate,"Sell new and used vehicles to customers, providing exceptional service and meeting sales targets.","[""Sales"", ""Customer Service"", ""Automotive Knowledge"", ""Negotiation""]","[""High school diploma or equivalent."", ""Strong sales and customer service skills."", ""Knowledge of automotive features and benefits."", ""1+ years of experience in vehicle sales preferred.""]",2024-11-22 22:04:04,2024-11-22 22:04:04,
1f868077-8d51-4721-a1e7-ed1278c351ff,6737229d946638310000a3d6,Wholesale and retail trade; repair and maintenance of motor vehicles,Vehicle Inspector,"Conduct thorough inspections of vehicles to ensure safety, compliance, and performance standards are met.","[""Inspection"", ""Safety Standards"", ""Diagnostics"", ""Attention to Detail""]","[""Certification in vehicle inspection or equivalent training."", ""Strong knowledge of vehicle systems and safety regulations."", ""Attention to detail and problem-solving skills."", ""1-3 years of experience in vehicle inspections.""]",2024-11-22 22:04:04,2024-11-22 22:04:04,
2ddff3c3-48c2-4b1d-ab31-daabed98178c,6737229d946638310000a3d7,Wholesale and retail trade; repair and maintenance of motor vehicles,Fleet Maintenance Manager,"Oversee the repair and maintenance of a fleet of vehicles, ensuring minimal downtime and cost efficiency.","[""Fleet Management"", ""Maintenance"", ""Scheduling"", ""Budgeting""]","[""Bachelor’s degree in Automotive Management or related field preferred."", ""Experience in fleet maintenance or vehicle management."", ""Strong organizational and leadership skills."", ""3+ years of experience in fleet maintenance.""]",2024-11-22 22:04:04,2024-11-22 22:04:04,
e4b4dbbd-ab33-41ec-90c0-6b038683f553,6737229d946638310000a3d8,Wholesale and retail trade; repair and maintenance of motor vehicles,Tire Technician,"Inspect, repair, and replace vehicle tires, ensuring safety and proper alignment.","[""Tire Repair"", ""Alignment"", ""Maintenance"", ""Customer Service""]","[""High school diploma or equivalent."", ""Experience with tire installation and repair tools."", ""Knowledge of tire safety and maintenance standards."", ""1+ years of experience as a tire technician preferred.""]",2024-11-22 22:04:04,2024-11-22 22:04:04,
96646b7e-f0a4-4968-ac7b-259f9ef010d3,6737229d946638310000a3d9,Wholesale and retail trade; repair and maintenance of motor vehicles,Retail Store Manager - Automotive Parts,"Manage daily operations of an automotive parts retail store, ensuring excellent customer service and inventory control.","[""Retail Management"", ""Inventory Management"", ""Sales"", ""Team Leadership""]","[""Bachelor’s degree in Business or related field preferred."", ""Experience in retail management, especially in automotive parts."", ""Strong leadership and organizational skills."", ""3+ years of experience in retail management.""]",2024-11-22 22:04:04,2024-11-22 22:04:04,
eb098a4e-f077-492f-90e0-f439c3005f77,6737229d946638310000a3da,Transportation and Storage,Logistics Coordinator,Plan and oversee transportation and storage of goods to ensure efficient supply chain operations.,"[""Logistics"", ""Supply Chain Management"", ""Scheduling"", ""Coordination""]","[""Bachelor’s degree in Logistics, Business, or related field."", ""Experience with logistics software (e.g., SAP, Oracle)."", ""Strong organizational and multitasking skills."", ""2+ years of experience in logistics.""]",2024-11-22 22:04:04,2024-11-22 22:04:04,
ebff1b91-372d-4d9e-8fcd-21ea571fcf5b,6737229d946638310000a3db,Transportation and Storage,Truck Driver,Transport goods safely and efficiently while adhering to regulations and schedules.,"[""Driving"", ""Safety Compliance"", ""Time Management"", ""Long-Haul""]","[""Valid commercial driver’s license (CDL)."", ""Clean driving record."", ""Experience with long-haul or local deliveries."", ""Strong understanding of traffic and safety regulations.""]",2024-11-22 22:04:04,2024-11-22 22:04:04,
b856ec37-31c8-4fa0-b5b3-25c77fa0ba97,6737229d946638310000a3dc,Transportation and Storage,Warehouse Manager,"Oversee warehouse operations, including inventory management, staff supervision, and logistics coordination.","[""Inventory Management"", ""Team Leadership"", ""Logistics"", ""Problem Solving""]","[""Bachelor’s degree in Business, Logistics, or related field."", ""Experience in warehouse management."", ""Strong leadership and organizational skills."", ""3+ years of experience in warehouse operations.""]",2024-11-22 22:04:04,2024-11-22 22:04:04,
8aea5e53-5a91-4a64-b1cd-9ba998c605cb,6737229d946638310000a3dd,Transportation and Storage,Fleet Manager,"Manage a fleet of vehicles, ensuring proper maintenance, compliance, and cost efficiency.","[""Fleet Management"", ""Maintenance"", ""Scheduling"", ""Regulatory Compliance""]","[""Bachelor’s degree in Logistics or related field preferred."", ""Experience in fleet or transportation management."", ""Knowledge of maintenance protocols and regulations."", ""3+ years of experience in fleet management.""]",2024-11-22 22:04:04,2024-11-22 22:04:04,
2d203d71-769c-4a50-9946-e12c12baddb6,6737229d946638310000a3de,Transportation and Storage,Cargo Handler,"Load, unload, and move cargo safely and efficiently in warehouses or transportation hubs.","[""Manual Labor"", ""Safety Compliance"", ""Teamwork"", ""Efficiency""]","[""High school diploma or equivalent."", ""Experience in cargo handling or warehouse work preferred."", ""Ability to lift heavy items and operate equipment."", ""Knowledge of safety standards is a plus.""]",2024-11-22 22:04:04,2024-11-22 22:04:04,
03fa7f7b-eb7a-4f17-96c2-e10ef3519dd8,6737229d946638310000a3df,Transportation and Storage,Supply Chain Analyst,Analyze supply chain processes and provide insights to improve efficiency and reduce costs.,"[""Data Analysis"", ""Supply Chain Management"", ""Optimization"", ""Problem Solving""]","[""Bachelor’s degree in Supply Chain Management, Business, or related field."", ""Proficiency in data analysis tools (e.g., Excel, Tableau, SQL)."", ""Experience with supply chain software is a plus."", ""2+ years of experience in supply chain or logistics analysis.""]",2024-11-22 22:04:04,2024-11-22 22:04:04,
18cc2270-977e-4560-940c-aafc605b292c,6737229d946638310000a3e0,Transportation and Storage,Air Freight Specialist,Coordinate and manage air freight shipments to ensure timely delivery and compliance with regulations.,"[""Air Freight"", ""Logistics"", ""Customer Service"", ""Regulatory Compliance""]","[""High school diploma or equivalent; Bachelor’s degree preferred."", ""Experience with air freight logistics and documentation."", ""Strong organizational and multitasking skills."", ""Knowledge of international shipping regulations.""]",2024-11-22 22:04:04,2024-11-22 22:04:04,
338b48d8-6af1-4faa-89bc-572228721f60,6737229d946638310000a3e1,Transportation and Storage,Customs Broker,Ensure imported and exported goods comply with customs regulations and manage clearance processes.,"[""Customs Compliance"", ""International Trade"", ""Documentation"", ""Customer Service""]","[""Customs Broker License (if required in your region)."", ""Knowledge of import/export regulations and procedures."", ""Strong attention to detail and documentation skills."", ""Experience in logistics or freight forwarding is a plus.""]",2024-11-22 22:04:04,2024-11-22 22:04:04,
611dd5aa-293f-4389-945c-bacc6e926605,6737229d946638310000a3e2,Transportation and Storage,Rail Operations Manager,"Oversee rail transport operations, ensuring safety, efficiency, and on-time delivery.","[""Rail Operations"", ""Safety Compliance"", ""Logistics"", ""Team Management""]","[""Bachelor’s degree in Transportation Management, Logistics, or related field."", ""Experience with rail transport and logistics operations."", ""Strong leadership and organizational skills."", ""3+ years of experience in rail operations management.""]",2024-11-22 22:04:04,2024-11-22 22:04:04,
5f7a5585-a31e-4655-949e-05ca8b5e0a0b,6737229d946638310000a3e3,Transportation and Storage,Dispatch Coordinator,Schedule and dispatch vehicles or personnel to fulfill transportation requests efficiently.,"[""Dispatching"", ""Scheduling"", ""Communication"", ""Problem Solving""]","[""High school diploma or equivalent."", ""Experience in dispatching or transportation coordination."", ""Strong multitasking and communication skills."", ""Knowledge of dispatch software is a plus.""]",2024-11-22 22:04:04,2024-11-22 22:04:04,
14dcca76-ac87-4d8a-bdec-eac323cd52b9,6737229d946638310000a3e4,Administrative and Support Activities,Administrative Assistant,Provide administrative support to ensure efficient operation of the office.,"[""Organization"", ""Scheduling"", ""Communication"", ""Office Management""]","[""High school diploma or equivalent; associate’s degree preferred."", ""Proficiency in office software (e.g., Microsoft Office Suite)."", ""Strong organizational and multitasking skills."", ""1+ years of experience in an administrative role.""]",2024-11-22 22:04:04,2024-11-22 22:04:04,
86bda36b-d6b6-4fe7-aa5b-9037c0e9efa4,6737229d946638310000a3e5,Administrative and Support Activities,Human Resources Coordinator,"Assist with HR processes, including recruitment, onboarding, and employee relations.","[""HR Support"", ""Recruitment"", ""Employee Relations"", ""Documentation""]","[""Bachelor’s degree in Human Resources, Business Administration, or related field."", ""Experience in HR or administrative roles."", ""Strong communication and interpersonal skills."", ""Proficiency in HR management software is a plus.""]",2024-11-22 22:04:04,2024-11-22 22:04:04,
2b9a7533-7d37-41b6-9ce0-900feb477d6a,6737229d946638310000a3e6,Administrative and Support Activities,Office Manager,"Oversee daily operations of the office, ensuring efficient workflows and smooth communication.","[""Office Management"", ""Leadership"", ""Budgeting"", ""Problem Solving""]","[""Bachelor’s degree in Business Administration or related field."", ""Experience in office management or administration."", ""Strong leadership and problem-solving skills."", ""2+ years of experience managing office operations.""]",2024-11-22 22:04:04,2024-11-22 22:04:04,
608a7609-117c-405f-b03a-67a31e035872,6737229d946638310000a3e7,Administrative and Support Activities,Call Center Supervisor,"Manage call center agents, monitor performance, and ensure excellent customer service.","[""Call Center Management"", ""Customer Service"", ""Team Leadership"", ""Reporting""]","[""High school diploma or equivalent; associate’s degree preferred."", ""Experience in customer service or call center operations."", ""Strong leadership and organizational skills."", ""1+ years of supervisory experience.""]",2024-11-22 22:04:04,2024-11-22 22:04:04,
80166a35-de15-44b3-bb89-8c4dc556594b,6737229d946638310000a3e8,Administrative and Support Activities,Receptionist,"Greet visitors, manage phone calls, and handle front desk operations in a professional manner.","[""Customer Service"", ""Front Desk"", ""Organization"", ""Multitasking""]","[""High school diploma or equivalent."", ""Experience in customer service or front desk roles preferred."", ""Proficiency in office software and phone systems."", ""Strong interpersonal and organizational skills.""]",2024-11-22 22:04:04,2024-11-22 22:04:04,
9b3d2f2e-3850-4e5a-ad7b-05b4e7991318,6737229d946638310000a3e9,Finance and Insurance,Financial Analyst,Analyze financial data and provide insights to support decision-making and improve company performance.,"[""Financial Analysis"", ""Budgeting"", ""Forecasting"", ""Data Interpretation""]","[""Bachelor’s degree in Finance, Accounting, or related field."", ""Proficiency in financial modeling and analysis tools (e.g., Excel, Tableau)."", ""Strong analytical and problem-solving skills."", ""2+ years of experience in financial analysis.""]",2024-11-22 22:04:04,2024-11-22 22:04:04,
15ca9fdb-7ab5-49f9-9090-be6fb7814eda,6737229d946638310000a3ea,Finance and Insurance,Insurance Underwriter,Evaluate applications for insurance coverage and determine appropriate terms and premiums.,"[""Risk Assessment"", ""Insurance Policies"", ""Decision Making"", ""Attention to Detail""]","[""Bachelor’s degree in Finance, Insurance, or related field."", ""Knowledge of underwriting principles and practices."", ""Strong analytical and communication skills."", ""Experience in insurance underwriting is preferred.""]",2024-11-22 22:04:04,2024-11-22 22:04:04,
7adb83a8-9a7e-40d3-9699-7fff0bcb8cf5,6737229d946638310000a3eb,Finance and Insurance,Credit Analyst,Assess creditworthiness of individuals or organizations and recommend loan approvals or denials.,"[""Credit Analysis"", ""Risk Assessment"", ""Financial Reports"", ""Decision Making""]","[""Bachelor’s degree in Finance, Economics, or related field."", ""Experience in credit or risk analysis."", ""Proficiency in financial reporting tools."", ""Strong problem-solving and analytical skills.""]",2024-11-22 22:04:04,2024-11-22 22:04:04,
aa8f46ec-2976-45cc-ba7b-a81b8fdc6952,6737229d946638310000a3ec,Finance and Insurance,Investment Advisor,Provide financial planning advice and investment recommendations to clients.,"[""Investment Strategy"", ""Client Relations"", ""Market Research"", ""Financial Planning""]","[""Bachelor’s degree in Finance, Economics, or related field."", ""Certification as a Certified Financial Planner (CFP) or equivalent is preferred."", ""Strong knowledge of investment products and markets."", ""2+ years of experience in financial advising.""]",2024-11-22 22:04:04,2024-11-22 22:04:04,
441db979-06bf-4d8e-868d-5a7d661ffabc,6737229d946638310000a3ed,Finance and Insurance,Claims Adjuster,Investigate insurance claims and determine fair settlements for policyholders.,"[""Claims Investigation"", ""Negotiation"", ""Customer Service"", ""Regulatory Compliance""]","[""High school diploma or equivalent; Bachelor’s degree preferred."", ""Knowledge of insurance claims processes."", ""Strong negotiation and communication skills."", ""Experience in claims adjustment is a plus.""]",2024-11-22 22:04:04,2024-11-22 22:04:04,
43390682-a3df-4102-928e-1f32c90eac58,6737229d946638310000a3ee,Finance and Insurance,Tax Advisor,"Advise individuals and businesses on tax planning, preparation, and strategies to minimize tax liability.","[""Tax Planning"", ""Financial Consulting"", ""Regulations"", ""Compliance""]","[""Bachelor’s degree in Accounting, Finance, or related field."", ""Certified Public Accountant (CPA) certification preferred."", ""In-depth knowledge of tax laws and regulations."", ""2+ years of experience in tax advisory or preparation.""]",2024-11-22 22:04:04,2024-11-22 22:04:04,
1b03c562-a2b8-4c56-9716-c211ca67c033,6737229d946638310000a3ef,Finance and Insurance,Insurance Claims Examiner,"Examine insurance claims, evaluate the validity of claims, and process settlements for policyholders.","[""Claims Processing"", ""Insurance"", ""Risk Management"", ""Documentation""]","[""High school diploma or equivalent; Bachelor’s degree preferred."", ""Experience in claims processing or insurance-related roles."", ""Strong attention to detail and analytical skills."", ""Knowledge of insurance policies and regulations.""]",2024-11-22 22:04:04,2024-11-22 22:04:04,
4e9e581e-dbad-43d7-a605-6380dcee7ffd,6737229d946638310000a3f0,Finance and Insurance,Mortgage Loan Officer,"Help clients obtain mortgage loans by advising on loan options, processing applications, and ensuring timely approvals.","[""Mortgage"", ""Loan Processing"", ""Client Relations"", ""Real Estate""]","[""Bachelor’s degree in Finance, Business, or related field."", ""Experience in mortgage lending or real estate finance."", ""Excellent communication and negotiation skills."", ""Knowledge of mortgage products and financial regulations.""]",2024-11-22 22:04:04,2024-11-22 22:04:04,
dfc45a85-a085-4177-b7f1-f84e8d5f24f9,6737229d946638310000a3f1,Finance and Insurance,Risk Manager,"Identify, evaluate, and manage financial risks to ensure that the organization maintains a stable financial position.","[""Risk Assessment"", ""Risk Mitigation"", ""Insurance"", ""Compliance""]","[""Bachelor’s degree in Finance, Business, or Risk Management."", ""Experience in risk management or financial services."", ""Strong analytical and decision-making skills."", ""Knowledge of risk management tools and strategies.""]",2024-11-22 22:04:04,2024-11-22 22:04:04,
b496568a-63eb-47f6-a484-5d439bb57581,6737229d946638310000a3f2,Finance and Insurance,Actuary,Analyze financial risks and uncertainties using mathematical models and statistics to help organizations make informed decisions.,"[""Data Analysis"", ""Risk Assessment"", ""Mathematics"", ""Statistical Modeling""]","[""Bachelor’s degree in Actuarial Science, Mathematics, or related field."", ""Proficiency in actuarial software and statistical tools."", ""Strong problem-solving and analytical skills."", ""Completion of actuarial exams (or in progress) is required.""]",2024-11-22 22:04:04,2024-11-22 22:04:04,
66d89a09-6053-4bb3-a1db-0bd31ed5c187,6737229d946638310000a3f3,Information and Communication,Software Developer,"Design, develop, and maintain software applications tailored to client needs.","[""Software Development"", ""Programming"", ""Agile"", ""Problem Solving""]","[""Bachelor’s degree in Computer Science or related field."", ""Proficiency in programming languages (e.g., Python, Java, C#)."", ""Experience with Agile methodologies."", ""2+ years of software development experience.""]",2024-11-22 22:04:04,2024-11-22 22:04:04,
b2d31ea7-e4ef-49fc-920e-81b5f8ef598f,6737229d946638310000a3f4,Information and Communication,Data Analyst,Analyze data to help organizations make informed business decisions.,"[""Data Analysis"", ""SQL"", ""Visualization"", ""Problem Solving""]","[""Bachelor’s degree in Data Science, Statistics, or related field."", ""Proficiency in data analysis tools (e.g., Excel, Tableau, R)."", ""Experience with SQL and database management."", ""1+ years of experience in data analytics.""]",2024-11-22 22:04:04,2024-11-22 22:04:04,
aff871de-7d76-4921-85ec-6ec7e66e117a,6737229d946638310000a3f5,Information and Communication,Network Administrator,Manage and maintain an organization's computer networks to ensure uptime and security.,"[""Networking"", ""IT Support"", ""Security"", ""Troubleshooting""]","[""Bachelor’s degree in Information Technology or related field."", ""Experience with network hardware and software."", ""Strong troubleshooting and problem-solving skills."", ""2+ years of experience in network administration.""]",2024-11-22 22:04:04,2024-11-22 22:04:04,
aba05675-5c1e-48d4-943a-26065487101c,6737229d946638310000a3f6,Information and Communication,Digital Marketing Specialist,Develop and execute digital campaigns to increase online visibility and sales.,"[""SEO"", ""Social Media Marketing"", ""Content Creation"", ""Analytics""]","[""Bachelor’s degree in Marketing, Communications, or related field."", ""Proficiency in digital marketing tools (e.g., Google Analytics, AdWords)."", ""Experience with social media platforms and content creation."", ""2+ years of experience in digital marketing.""]",2024-11-22 22:04:04,2024-11-22 22:04:04,
471bd52a-ff32-473d-a2eb-5e1939d8d1b5,6737229d946638310000a3f7,Information and Communication,Cybersecurity Specialist,Protect an organization's systems and data from cyber threats.,"[""Cybersecurity"", ""Risk Management"", ""IT Security"", ""Ethical Hacking""]","[""Bachelor’s degree in Cybersecurity or Information Technology."", ""Experience with firewalls, VPNs, and security protocols."", ""Relevant certifications (e.g., CISSP, CEH) preferred."", ""2+ years of experience in IT security.""]",2024-11-22 22:04:04,2024-11-22 22:04:04,
28424a2a-21fc-4390-a5b8-0412fbcd42cb,6737229d946638310000a3f8,Accommodation and Hospitality,Hotel Manager,"Oversee daily hotel operations, ensuring guest satisfaction and efficient service.","[""Management"", ""Guest Relations"", ""Operations"", ""Budgeting""]","[""Bachelor’s degree in Hospitality Management or related field."", ""Strong leadership and organizational skills."", ""Experience with hotel management software."", ""3+ years of experience in hospitality management.""]",2024-11-22 22:04:04,2024-11-22 22:04:04,
f5b9bfb3-4e48-4d25-9c7a-ae62a665a68e,6737229d946638310000a3f9,Accommodation and Hospitality,Chef,Plan and prepare high-quality meals while managing kitchen staff and inventory.,"[""Cooking"", ""Kitchen Management"", ""Creativity"", ""Food Safety""]","[""Culinary degree or equivalent training."", ""Experience in menu planning and inventory management."", ""Strong leadership and creative skills."", ""3+ years of experience as a chef.""]",2024-11-22 22:04:04,2024-11-22 22:04:04,
aabfcae3-eaae-4885-9478-e1dbf77a0ddf,6737229d946638310000a3fa,Accommodation and Hospitality,Event Coordinator,"Plan and execute events, ensuring client satisfaction and seamless operations.","[""Event Planning"", ""Budget Management"", ""Logistics"", ""Customer Service""]","[""Bachelor’s degree in Event Management, Hospitality, or related field."", ""Strong organizational and communication skills."", ""Experience with event planning tools."", ""2+ years of experience in event coordination.""]",2024-11-22 22:04:04,2024-11-22 22:04:04,
00ac9c4e-26b8-4bf3-baa2-3f392328205a,6737229d946638310000a3fb,Accommodation and Hospitality,Housekeeping Supervisor,"Supervise housekeeping staff, ensuring rooms and public areas meet cleanliness standards.","[""Supervision"", ""Quality Control"", ""Time Management"", ""Hospitality""]","[""High school diploma or equivalent."", ""Experience in housekeeping or hospitality."", ""Strong organizational and leadership skills."", ""2+ years of experience in housekeeping management.""]",2024-11-22 22:04:04,2024-11-22 22:04:04,
ca426aa0-2e91-4c44-95d3-39dfabfc8f6c,6737229d946638310000a3fc,Accommodation and Hospitality,Front Desk Agent,"Handle guest check-ins and check-outs, answer inquiries, and provide exceptional customer service.","[""Customer Service"", ""Problem Solving"", ""Multitasking"", ""Communication""]","[""High school diploma or equivalent."", ""Experience in hospitality or customer service preferred."", ""Proficiency with reservation software is a plus."", ""Strong interpersonal skills.""]",2024-11-22 22:04:04,2024-11-22 22:04:04,
f7dfd6f7-ff02-484f-b238-efee21e45e8f,6737229d946638310000a3fd,Information and Communication,Software Developer,"Develop, test, and maintain software applications to meet business and user needs.","[""Software Development"", ""Programming"", ""Tech Skills"", ""Problem Solving""]","[""Bachelor’s degree in Computer Science, Information Technology, or related field."", ""Proficiency in programming languages (e.g., Java, Python, C++)."", ""Experience with software development frameworks and tools."", ""Strong problem-solving skills and attention to detail.""]",2024-11-22 22:04:04,2024-11-22 22:04:04,
3f03bdc5-8c4d-412a-963c-28d7110b02c1,6737229d946638310000a3fe,Information and Communication,Network Administrator,Manage and maintain the company’s computer networks to ensure smooth and secure operations.,"[""Networking"", ""IT Support"", ""System Maintenance"", ""Security""]","[""Bachelor’s degree in Information Technology or related field."", ""Experience in network administration and troubleshooting."", ""Knowledge of networking protocols and security systems."", ""Certifications such as CCNA or CompTIA Network+ are a plus.""]",2024-11-22 22:04:04,2024-11-22 22:04:04,
80c0f998-1650-4d66-8810-6eb238542b21,6737229d946638310000a3ff,Information and Communication,Content Writer,"Create engaging written content for websites, blogs, social media, and other digital platforms.","[""Writing"", ""Content Creation"", ""SEO"", ""Creativity""]","[""Bachelor’s degree in Journalism, Communications, or related field."", ""Experience in writing and content creation."", ""Familiarity with SEO best practices and keyword research."", ""Excellent writing, editing, and proofreading skills.""]",2024-11-22 22:04:04,2024-11-22 22:04:04,
adeba567-6405-4b43-942a-6ce6a7e6b4f5,6737229d946638310000a400,Information and Communication,Digital Marketing Specialist,"Develop and implement online marketing strategies to drive traffic, engagement, and conversions.","[""Digital Marketing"", ""SEO"", ""PPC"", ""Social Media""]","[""Bachelor’s degree in Marketing, Communications, or related field."", ""Experience with digital marketing tools and platforms (e.g., Google Analytics, Facebook Ads)."", ""Strong understanding of SEO and SEM."", ""Ability to analyze marketing data and adjust strategies accordingly.""]",2024-11-22 22:04:04,2024-11-22 22:04:04,
375f2d70-97c2-4418-8660-8c32f0b45b02,6737229d946638310000a401,Information and Communication,IT Support Specialist,"Provide technical support to employees, troubleshooting hardware, software, and network issues.","[""IT Support"", ""Troubleshooting"", ""Customer Service"", ""Technical Skills""]","[""Bachelor’s degree in Information Technology or related field."", ""Experience in IT support or customer service."", ""Proficiency in diagnosing hardware and software issues."", ""Excellent communication skills and ability to work under pressure.""]",2024-11-22 22:04:04,2024-11-22 22:04:04,
